"Mark Robinson Quote","Terrible Person Quote"
"Be the change you wish to see in the world.","I have nothing to declare except my genius." - Oscar Wilde
"Success is not final, failure is not fatal: It is the courage to continue that counts.","I don't care about what people think about me, as long as they think about me." - Andy Warhol
"The only way to do great work is to love what you do.","I have never seen a thin person drinking Diet Coke." - Donald Trump
"In the middle of every difficulty lies opportunity.","I'm not a dictator. It's just that I have a grumpy face." - Kim Jong-un
"Believe you can and you're halfway there.","I'm not a psychopath, I'm a high-functioning sociopath." - Sherlock Holmes